Title,Link,Image,Description
Le pape demande la libération des six religieuses enlevées à Port-au-Prince,/article/246446/le-pape-demande-la-liberation-des-six-religieuses-enlevees-a-port-au-prince,https://cdn.lenouvelliste.com/shared/skeleton-image.webp,"
Le pape François a appelé dimanche à la libération d'un groupe de huit personnes, dont six religieuses, enlevées en Haïti, pays ravagé par la violence des gangs."
Le MENFP s’associe avec des fédérations sportives pour encourager la pratique du sport en milieu scolaire,/article/246430/le-menfp-sassocie-avec-des-federations-sportives-pour-encourager-la-pratique-du-sport-en-milieu-scolaire,https://cdn.lenouvelliste.com/shared/skeleton-image.webp,"Le ministère de l’Éducation nationale et de la Formation professionnelle (MENFP) a signé trois protocoles d’accord avec les Fédérations haïtiennes de football, de basketball et de volley-ball, le vendredi 19 janvier 2024, au local de l’Inspection générale de l’Éducation nationale, à Musseau. Cette cérémonie, qui s’est déroulée en présence du ministre de l’Éducation nationale, Nesmy Manigat, et de représentants desdites fédérations, rentre dans le cadre des efforts déployés par le MENFP pour valoriser le sport dans les écoles."
"Pas de discussions réelles en vue de la sortie de crise, le Collectif du 30 janvier dénonce une campagne de propagande du pouvoir",/article/246409/pas-de-discussions-reelles-en-vue-de-la-sortie-de-crise-le-collectif-du-30-janvier-denonce-une-campagne-de-propagande-du-pouvoir,https://cdn.lenouvelliste.com/shared/skeleton-image.webp,"
À 21 jours du 7 février 2024, date de la transmission du pouvoir à des élus, selon les termes de l’accord du 21 décembre 2022, il n’y a toujours pas d’initiatives concrètes pouvant permettre d’aboutir à un dégel de la crise haïtienne."
